{"body":"## Overall\nI found no factual or inferential defects. Five sampled citations resolved cleanly, and the challenged claims were directly grounded in source files that were examined directly. One interpretive challenge is defensible: `auth-001` reads `src/mcp_server_git/__init__.py` as the routing authority, but the same evidence also supports a distributed routing reading across `pyproject.toml` and `src/mcp_server_git/__main__.py`.\n\n## Factual / inferential challenges\nNone substantiated.\n\n## Interpretive challenges\n### CHL-00001: centrality / scope_dispute\n- Claim location: `auth-001`\n- Original reading: `src/mcp_server_git/__init__.py` is the routing authority because both the console script and the `python -m` path land in the same `main` entrypoint.\n- Competing reading: routing authority is distributed across `pyproject.toml` and `__main__.py`; `__init__.py` is the shared command implementation rather than the central authority.\n- Competing evidence: `pyproject.toml:25-26@4503e2d12b79`, `src/mcp_server_git/__main__.py:1-5@4503e2d12b79`, `src/mcp_server_git/__init__.py:7-24@4503e2d12b79`\n- Why this alternative is defensible: the launch surfaces are declared in packaging metadata and the module shim, while `__init__.py` only defines the callable they invoke.\n\n## Spot-check sample\n| Citation | Resolves | Supports claim |\n|---|---|---|\n| `src/mcp_server_git/__init__.py:7-24@4503e2d12b79` | yes | yes |\n| `pyproject.toml:25-26@4503e2d12b79` | yes | yes |\n| `src/mcp_server_git/server.py:120-126@4503e2d12b79` | yes | yes |\n| `src/mcp_server_git/server.py:237-255@4503e2d12b79` | yes | yes |\n| `tests/test_server.py:318-484@4503e2d12b79` | yes | yes |\n\n## Coverage check\n- Files claimed about but not in `files_examined_directly`: none\n\n## Recommendations\n- Mark `auth-001` as `challenged` to reflect the distributed-routing reading.\n- No defect-level changes are needed; the sampled factual claims are supported by the source.","findings_logged":1,"challenge_ids":["chl-00001"],"factual_spot_checks":5,"interpretive_challenges_attempted":1,"challenges":[{"claim_id":"auth-001","competing_reading":"Routing authority is distributed across `pyproject.toml` and `__main__.py`; `__init__.py` is the shared command implementation rather than the central authority.","competing_evidence":["pyproject.toml:25-26@4503e2d12b79","src/mcp_server_git/__main__.py:1-5@4503e2d12b79","src/mcp_server_git/__init__.py:7-24@4503e2d12b79"],"interpretive_axis":"centrality","relation_to_original":"scope_dispute","rationale":"The launch surfaces are declared in packaging metadata and the module shim, while `__init__.py` only defines the callable they invoke."}]}